Section,Question,Answer
Section 1: Company Profile & Strategic Alignment,Company Name,TechDefense Solutions Inc.
Section 1: Company Profile & Strategic Alignment,Primary NAICS Codes (Only GovCon),"541511 - Custom Computer Programming Services, 541512 - Computer Systems Design Services"
Section 1: Company Profile & Strategic Alignment,Revenue,M - M
Section 1: Company Profile & Strategic Alignment,Number of Employees,150-300
Section 1: Company Profile & Strategic Alignment,Company Type: GovCon Healthcare Finance or Industrial,GovCon
Section 1: Company Profile & Strategic Alignment,What is your company's overall mission and how does AI fit into it?,"Our mission is to provide cutting-edge AI solutions for national defense and security. AI is central to our strategy for enhancing military intelligence, cybersecurity, and autonomous systems."
Section 1: Company Profile & Strategic Alignment,Do you have a formal AI strategy or roadmap? If yes please provide details or documents.,"Yes, we have a comprehensive 3-year AI roadmap focusing on computer vision for ISR, NLP for intelligence analysis, and autonomous systems for defense applications."
Section 1: Company Profile & Strategic Alignment,Which of the following best describes your AI posture?,Strategic - AI is integrated into our core strategy and drives significant business value.
Section 1: Company Profile & Strategic Alignment,Is there a designated AI lead chief AI officer or equivalent executive role? If yes provide name/title.,"Yes, Dr. Sarah Chen serves as our Chief AI Officer and reports directly to the CEO."
Section 1: Company Profile & Strategic Alignment,Who is responsible to AI strategy within your organization?,"Dr. Sarah Chen (CAIO) leads AI strategy with support from our AI Steering Committee including CTO, VP of Engineering, and Business Development leads."
Section 1: Company Profile & Strategic Alignment,What % of your internal Executive/Management Team meetings are discussing AI initiatives?,"Approximately 40% of our executive meetings include AI discussions, with dedicated AI strategy sessions monthly."
Section 1: Company Profile & Strategic Alignment,What business outcomes are you aiming to achieve with AI over the next 12–24 months?,"Increase contract win rate by 25%, reduce system response times by 50%, and expand into new AI-enabled service lines worth M+ annually."
Section 1: Company Profile & Strategic Alignment,Which of the following best describes your AI investment approach? Opportunistic Strategic Innovation-led or Not yet defined,Strategic - We have allocated 15% of our R&D budget specifically for AI initiatives and talent acquisition.
Section 1: Company Profile & Strategic Alignment,In which areas does your leadership see the greatest risk or resistance to AI adoption?,"Security clearance requirements for AI talent, regulatory compliance complexity, and integration challenges with legacy DoD systems."
Section 1: Company Profile & Strategic Alignment,Get-Well Plan ‚ Section 1: Company Profile & Strategic Alignment,"Develop a comprehensive AI governance framework, establish AI ethics board, and create clear AI ROI metrics for executive reporting."
Section 2: AI Capabilities & Technical Maturity,Which of the following AI/ML capabilities does your company currently possess or deliver?,"Data engineering and preparation, Machine learning model development, Natural language processing (NLP), Computer vision, MLOps / model deployment and monitoring, AI for predictive analytics and decision support, AI integration into existing applications or workflows, Responsible AI (ethics fairness explainability)"
Section 2: AI Capabilities & Technical Maturity,Describe your internal AI development capability (e.g. number of AI/ML engineers data scientists tools used).,"We have 25 AI/ML engineers, 8 data scientists, and 5 MLOps specialists. We use TensorFlow, PyTorch, AWS SageMaker, and custom deployment pipelines."
Section 2: AI Capabilities & Technical Maturity,Do you use open-source proprietary or government-provided models? Please specify examples.,"We use a combination: open-source models (BERT, ResNet), proprietary models (AWS Bedrock), and government-provided models (NIST AI RMF frameworks)."
Section 2: AI Capabilities & Technical Maturity,What development frameworks and toolchains are most commonly used?,"TensorFlow, PyTorch, AWS SageMaker, MLflow, Docker, Kubernetes, GitLab CI/CD, and custom MLOps pipelines."
Section 2: AI Capabilities & Technical Maturity,Do you have a formal AI/ML lifecycle management system in place?,"Yes, we have implemented MLflow for model versioning, AWS SageMaker for deployment, and custom monitoring dashboards for model performance tracking."
Section 2: AI Capabilities & Technical Maturity,Do you conduct independent AI R&D? If yes list notable efforts funding sources or publications.,"Yes, we have M in SBIR funding for AI research, partnerships with MIT and Carnegie Mellon, and have published 12 papers in AI conferences."
Section 2: AI Capabilities & Technical Maturity,How frequently do you use AI tools in your day-to-day work?,"Daily - Our team uses AI tools for code generation, data analysis, and automated testing on a regular basis."
Section 2: AI Capabilities & Technical Maturity,What types of AI tools do you personally use?,"ChatGPT, Microsoft Copilot, Custom AI tools, GitHub Copilot, and internal AI assistants for documentation and code review."
Section 2: AI Capabilities & Technical Maturity,For which tasks do you most commonly use AI? Include Use Case Summary if Applicable,"Code generation and debugging, Data analysis and visualization, Research and summarization, Automated testing and quality assurance"
Section 2: AI Capabilities & Technical Maturity,How confident are you in using AI tools effectively?,Very confident (8/10) - Our team has extensive training and hands-on experience with various AI tools and platforms.
Section 2: AI Capabilities & Technical Maturity,In which business functions is AI currently being used?,"Engineering, Operations, Customer Service, Business Development, and Proposal Writing"
Section 2: AI Capabilities & Technical Maturity,How do you currently measure the impact or success of your AI solutions?,"We track accuracy metrics, processing time reduction, cost savings, and customer satisfaction scores for all AI implementations."
Section 2: AI Capabilities & Technical Maturity,Which stages of the AI lifecycle are you strongest in and which need the most improvement?,Strongest: Model development and deployment. Need improvement: Data quality assurance and long-term model monitoring.
Section 2: AI Capabilities & Technical Maturity,Do you follow any AI maturity model or framework to guide capability development?,"Yes, we follow the NIST AI RMF and have adapted the Gartner AI Maturity Model for our internal assessments."
Section 2: AI Capabilities & Technical Maturity,What AI capabilities do you consider essential to build or acquire in the next 12–24 months?,"Federated learning for multi-agency collaboration, edge AI deployment capabilities, and advanced explainable AI for regulatory compliance."
Section 2: AI Capabilities & Technical Maturity,Do you have a data infrastructure strategy?,"Yes, we have a comprehensive data strategy including data lakes, real-time processing pipelines, and secure data sharing protocols for government clients."
Section 2: AI Capabilities & Technical Maturity,Get-Well Plan AI Section 2: AI Capabilities & Technical Maturity,"Implement automated data quality checks, enhance model monitoring capabilities, and develop standardized AI deployment templates."
Section 3: Government AI Integration & Contract Performance,On which contracts have you delivered AI-enabled capabilities?,"We have delivered AI solutions on 8 DoD contracts including ISR systems for Air Force, cybersecurity AI for Army, and logistics optimization for Navy."
Section 3: Government AI Integration & Contract Performance,Are you currently on or pursuing any AI-specific IDIQs/BPAs?,"Yes, we are on the Tradewind OTA and pursuing the JEDI Cloud AI services BPA."
Section 3: Government AI Integration & Contract Performance,What security clearances or environments can your AI solutions operate within?,"Our AI solutions are certified for IL4, IL5, and SCIF environments. We have personnel with TS/SCI clearances."
Section 3: Government AI Integration & Contract Performance,Have you worked with government stakeholders on AI testing evaluation red teaming or risk management?,"Yes, we have conducted AI red teaming exercises with DARPA and participated in DoD AI testing and evaluation programs."
Section 3: Government AI Integration & Contract Performance,How do you ensure explainability fairness and ethical AI in federal applications?,"We implement SHAP and LIME for explainability, conduct bias audits, and follow DoD AI Ethical Principles and NIST AI RMF guidelines."
Section 3: Government AI Integration & Contract Performance,Are your AI tools or models accredited or certified for government use? If yes list them.,"Yes, our computer vision models are accredited under DoD's AI accreditation program, and our NLP systems are certified for IL4 environments."
Section 3: Government AI Integration & Contract Performance,How does your company typically introduce AI capabilities to potential government clients?,"Through technical demonstrations, pilot programs, and proof-of-concept projects that showcase real-world applications and ROI."
Section 3: Government AI Integration & Contract Performance,Do you use proof-of-concepts (POCs) or minimum viable products (MVPs) to demonstrate AI capabilities? Please provide examples.,"Yes, we developed a 90-day POC for automated threat detection that resulted in a M follow-on contract."
Section 3: Government AI Integration & Contract Performance,Are your customers inquiring about use of AI? If so in what way?,"Yes, customers are asking about AI for predictive maintenance, automated decision support, and enhanced cybersecurity capabilities."
Section 3: Government AI Integration & Contract Performance,What risk of disruption does Generative AI pose?,"Generative AI presents both opportunities (automated report generation, synthetic data creation) and risks (deepfake detection, content verification challenges)."
Section 3: Government AI Integration & Contract Performance,Are you partnered or subcontracted under any of the Big Primes for AI work?,"Yes, we are a subcontractor to Lockheed Martin and Raytheon for AI-enabled ISR and cybersecurity projects."
Section 3: Government AI Integration & Contract Performance,How does your AI capability align with current government priorities (e.g. autonomy ISR digital workforce)?,"Our AI capabilities directly support DoD's focus on autonomous systems, enhanced ISR capabilities, and digital workforce transformation initiatives."
Section 3: Government AI Integration & Contract Performance,Do you face procurement or regulatory barriers to AI adoption in government environments? If so describe.,"Yes, lengthy accreditation processes, data sharing restrictions, and complex compliance requirements can slow AI deployment in government environments."
Section 3: Government AI Integration & Contract Performance,Are you participating in any cross-agency AI initiatives testbeds or R&D challenges?,"Yes, we participate in DARPA's AI Next campaign, the Joint AI Center's testbed program, and various SBIR/STTR initiatives."
Section 3: Government AI Integration & Contract Performance,What is your go-to-market strategy for AI solutions in the public sector?,"Focus on high-impact use cases, demonstrate clear ROI, leverage existing government relationships, and participate in innovation programs and OTAs."
Section 3: Government AI Integration & Contract Performance,Get-Well Plan AI Section 3: Government AI Integration & Contract Performance,"Expand accreditation portfolio, develop standardized compliance frameworks, and create AI solution templates for faster deployment."
"Section 4: Partnerships, Ecosystem & Industry Engagement",Which AI hardware or cloud partners do you actively collaborate with?,"AWS, NVIDIA, Intel, and Microsoft Azure for cloud and hardware partnerships."
"Section 4: Partnerships, Ecosystem & Industry Engagement",Are you a participant in any government or academic consortia on AI?,"Yes, we are members of the National AI Initiative, the Defense Innovation Unit, and the AI Partnership for Defense."
"Section 4: Partnerships, Ecosystem & Industry Engagement",Do you have partnerships with any academic institutions for AI research or talent pipeline?,"Yes, we have partnerships with MIT, Carnegie Mellon, and Georgia Tech for research collaboration and talent recruitment."
"Section 4: Partnerships, Ecosystem & Industry Engagement",Do you collaborate with OpenAI Anthropic Cohere or other foundation model companies?,"Yes, we have partnerships with OpenAI for GPT models and are exploring collaborations with Anthropic for safety-focused AI applications."
"Section 4: Partnerships, Ecosystem & Industry Engagement","Get-Well Plan AI Section 4: Partnerships, Ecosystem & Industry Engagement","Expand academic partnerships, establish industry consortium leadership, and develop joint AI research initiatives."
"Section 5: AI Talent, Culture & Organizational Readiness",How many employees work in AI-related roles? Provide counts by function.,"25 AI/ML engineers, 8 data scientists, 5 MLOps specialists, 3 AI product managers, and 2 AI ethics specialists."
"Section 5: AI Talent, Culture & Organizational Readiness",Do you have AI-focused hiring goals or workforce development plans?,"Yes, we plan to hire 15 additional AI professionals in the next 12 months and have a comprehensive upskilling program for existing employees."
"Section 5: AI Talent, Culture & Organizational Readiness",Does your company offer AI training or upskilling programs internally?,"Yes, we offer monthly AI training sessions, sponsor conference attendance, and provide access to online AI courses and certifications."
"Section 5: AI Talent, Culture & Organizational Readiness",Do you have ethical guidelines or training in place for responsible AI use?,"Yes, we have comprehensive AI ethics guidelines, mandatory ethics training, and an AI ethics review board for all projects."
"Section 5: AI Talent, Culture & Organizational Readiness",Is AI incorporated into your company business development or proposal writing capabilities?,"Yes, we use AI for proposal writing assistance, competitive analysis, and automated compliance checking for government proposals."
"Section 5: AI Talent, Culture & Organizational Readiness",How is AI being integrated into internal business functions such as HR marketing finance and operations?,"AI is used for resume screening in HR, lead generation in marketing, financial forecasting, and operational efficiency optimization."
"Section 5: AI Talent, Culture & Organizational Readiness",Is AI used in any business development sales marketing or proposal-related processes? If so how?,"Yes, AI is used for market research, competitive intelligence, proposal content generation, and automated compliance checking."
"Section 5: AI Talent, Culture & Organizational Readiness",Is AI used in account planning or customer relationship strategies? If so describe how it informs targeting engagement or pipeline development.,"Yes, AI analyzes customer engagement patterns, predicts contract renewal likelihood, and identifies upselling opportunities for existing clients."
"Section 5: AI Talent, Culture & Organizational Readiness","Get-Well Plan AI Section 5: AI Talent, Culture & Organizational Readiness","Expand AI training programs, establish AI career paths, and create AI innovation labs for employee experimentation."
Section 6: Future Readiness & Differentiators,What emerging AI capabilities are you investing in?,"We are investing in federated learning, edge AI, quantum machine learning, and advanced explainable AI for regulatory compliance."
Section 6: Future Readiness & Differentiators,What do you see as your company's competitive advantage in the AI market you serve?,"Our deep government domain expertise, security clearance capabilities, and proven track record of delivering AI solutions in classified environments."
Section 6: Future Readiness & Differentiators,What challenges are you facing in scaling or deploying AI within your target market or client base?,"Talent acquisition in competitive market, lengthy government accreditation processes, and integration challenges with legacy systems."
Section 6: Future Readiness & Differentiators,Where do you see your company's role in the AI ecosystem over the next 3–5 years?,"We aim to be a leading AI solutions provider for national defense, with expanded capabilities in autonomous systems and cybersecurity AI."
Section 6: Future Readiness & Differentiators,Are you planning on reducing your workforce and replace it with AI?,"No, we plan to augment our workforce with AI capabilities while expanding our team to support growing AI demand."
Section 6: Future Readiness & Differentiators,Are there any current or upcoming AI initiatives you'd like to highlight for strategic investment or collaboration?,We are developing a next-generation AI platform for multi-domain operations and seeking strategic partnerships for quantum AI research.
Section 6: Future Readiness & Differentiators,Get-Well Plan AI Section 6: Future Readiness & Differentiators,"Develop AI innovation roadmap, establish strategic partnerships, and create AI investment fund for emerging technologies."
